{
  "version": "1.0",
  "kind": "executive",
  "meta": {
    "industry_id": "medical",
    "title": "medical Executive Report",
    "language": "ja"
  },
  "sections": [
    {
      "id": "summary",
      "title": "サマリー",
      "blocks": [
        {
          "type": "text",
          "data_path": "report_summary"
        }
      ]
    },
    {
      "id": "rcl",
      "title": "Convergence Layer",
      "blocks": [
        {
          "type": "rcl_summary",
          "data_path": "outputs.rcl"
        }
      ]
    }
  ]
}